{
  "adapter_version": "0.1.13",
  "architecture": "amd64",
  "client": "cursor",
  "client_version": "not-invoked (filesystem materialization only)",
  "dependency_identity": "streamable-http:https://mcp.context7.com/mcp/oauth",
  "distribution_id": "upstash/context7",
  "id": "context7/upstash-materialization-cursor-cli-0.1.13",
  "installer_version": "0.1.13",
  "level": "materialization",
  "manifest_digest": "sha256:d01781acd899aefa9445a290cf43a481230321934d62f9c8a2aab06a89718236",
  "observed_at": "2026-08-24T07:34:18Z",
  "os": "linux",
  "outcome": "passed",
  "package_tree_digest": "sha256:08eed3b67f2e71a11b68baa594380c2f69ec1bc97584d701deaf7942ac34c0d8",
  "product_id": "context7",
  "release_sequence": 1,
  "schema_version": 1,
  "source_path": "plugins/agent-plugins/context7",
  "source_repository": "upstash/context7",
  "source_revision": "769c6cd22c3d95462d1f55d789e9532cabefa5a9"
}
